post_id,tweet_text,status
6.38E+17,tired wish could sleep ,stressed
6.38E+17,young sad tire ,stressed
6.38E+17,im sad doyo wkwk worry ,stressed
6.38E+17,nikita tomar dr priyanka reddy naina kaur tired angry ,stressed
6.38E+17,tommy least amount power one human character smp tubbo shulk hes emotionally strong yet close due trauma ,stressed
6.38E+17,alot people dont know illuminati sad really ,stressed
6.38E+17,sad ,stressed
6.38E+17,also incredibly adjust nutrient depend baby sex ,stressed
6.38E+17,month hard work preparation parent finally open store retweet would much appr ,stressed
6.38E+17,young sad tire ,stressed
6.38E+17,im even tire frl ,stressed
6.38E+17,really tire twitter account always label behave unnaturally ,stressed
6.38E+17,superm member comment baekhyun dip sad ,stressed
6.38E+17,actually sadbestieyou would see crying meme tl ,stressed
6.37E+17,im sad ,stressed
6.37E+17,truth 3 yr sad ,stressed
6.37E+17,ray toro exist sad lgbt kid bad relationship parent trouble connect comm ,stressed
6.37E+17,friendship base moral principle incredibly important ,stressed
6.37E+17,powerpuff sad girl alt chart lol ,stressed
6.37E+17,god wish wasnt tired ,stressed
6.37E+17,sad happy take money ,stressed
6.37E+17,im tire ask love affection ,stressed
6.37E+17,opposite temperature different spot world rn sexual tension strong ,stressed
6.37E+17,sad story need tell honour majed hassan remember welcome people ,stressed
6.37E+17,best one make day twitter exclusive everyone insta tire shit ,stressed
6.36E+17,tell shes pretty like rn prolly sad sum ,stressed
6.36E+17,slut selfish bitch sad goodnight ,stressed
6.36E+17,awake want ,stressed
6.36E+17,god please reduce pain im tire tsp prankingkyle ,stressed
6.36E+17,still awake ssrians want say keep josh high keep fighting sushant cbi punish ssr ,stressed
6.36E+17,grow wild place near incredibly bright clear blue ,stressed
6.36E+17,ever lose parent lose parent year ago sometimes wake cry night sometimes liste ,stressed
6.36E+17,good even inbizhour tuck spag bol whilst im stuff face dont browse around ,stressed
6.36E+17,im tire time ,stressed
6.36E+17,deeply sad nothing say ethiopian ethnic tigrai doctor see beat deathoh god please act excellency president 100daysofgenocide ,stressed
6.36E+17,oh man im see new passing im incredibly shake kris genuinely one ,stressed
6.36E+17,galentines day bundle sale second bundle include lotion yep sell first ever lotion check limited quantity galentinesday treatyoself palntbased natural selfcare ,stressed
6.36E+17,im tired feel like im loosing every battle ,stressed
6.36E+17,tire even watch porn goodnight yall ,stressed
6.36E+17,climbers incredibly lucky survive avalanche near queenstown rescuer say ,stressed
6.36E+17,know im less angel come finish commission week two surely communication isnt hard ,stressed
6.36E+17,san antonio incredibly cold rn trinity mutual aid distribute blanket coat hand warmer lifepreser ,stressed
6.36E+17,ive travel lot place china motherland bf deny entrance shoo away temple didnt bring enough cash first day ox year sad ,stressed
6.36E+17,sleep nice youre tire sad depress ,stressed
6.36E+17,kaeya reason water flirt hes incredibly cunning charismatic know get people ,stressed
6.36E+17,tf happen army twitter could affect possibly dangerous explanation thread n ,stressed
6.36E+17,im tire everything everyone ,stressed
6.36E+17,officially divorce 5 minute ago know lot people say thing like congratulation view something ,stressed
6.36E+17,im get kinda tire corvette u give use lambo ,stressed
6.36E+17,sad january 6th go even sad donaldtrump get away murder ,stressed
6.36E+17,tired fcvk ,stressed
6.35E+17,honestly tire hindu death reason hindu time sample majoritarianism show though might politically wrong way past ,stressed
6.35E+17,truth 3 yr sad ,stressed
6.35E+17,sad truth even bjp power state remember delhi police hand center thing wouldnt change ,stressed
6.35E+17,get tired wait ,stressed
6.35E+17,partly also partly genuinely incredibly stupid people sheltered life surround sycophant tell sun shin arse ,stressed
6.35E+17,lack romanticism generation sad ,stressed
6.35E+17,boy get slaughter helpless mother could scream father trauma stupid expect global n ,stressed
6.35E+17,hey tl guess art awake ,stressed
6.35E+17,kannada stand comedy never grow stand comedian never dare venture beyond gandahend ,stressed
6.35E+17,hannah youre awake pleass talk im monely clingy inky ,stressed
6.35E+17,boy get slaughter helpless mother could scream father trauma stupid expect global n ,stressed
6.35E+17,im young stressed ,stressed
6.35E+17,fake smile easy explain youre sad ,stressed
6.35E+17,im tired cant sleeeeeep ,stressed
6.35E+17,way sing get tired wait wonder every come around faith fade softly like encompass feeling slowly lose hope well omfg tear wont stop flowing ,stressed
6.35E+17,better retweeting yes horny sad rn ,stressed
6.35E+17,sad day america ,stressed
6.35E+17,whos buyingnudes tonight still awake amp horny hmu request customs videos sellingnudes cumtribute findom premiumsnapchat sexting cumtribute cumslut hornybitch underagesex teenslut teengirl wetpussy underagepussy porn sex camsex dropbox dickrate ,stressed
6.35E+17,incredibly pain rinkusharma justice4rambhaktrinku enough enough even matter say ,stressed
6.35E+17,wl 5 fuck hard almost give zhonglis quest character die multiple time quickly ,stressed
6.35E+17,im tire see tweet like oh arent dont really care big matter anw dear ,stressed
6.35E+17,hate go bed early wake around time go bed get away im awake ,stressed
6.35E+17,tell shes pretty like rn prolly sad sum ,stressed
6.35E+17,tire drive night sting eye knuckle clench white still snow outside ,stressed
6.35E+17,arent tire one piece soundtrack since begin 1000 episode ,stressed
6.35E+17,complicated relationship mother gay general repression childhood trauma fuck ,stressed
6.35E+17,almost 3 im wide awake ,stressed
6.35E+17,ti drop everything jn give us big piece hard taeil hyung ,stressed
6.35E+17,sad 5 people die ,stressed
6.35E+17,make think people already make decision stay fl regardless covid status ive already decide visit spend dime fl leadership change bad sad ,stressed
6.35E+17,prison simple answer fail horribly theres simple answer trauma ppl struggle drug ,stressed
6.35E+17,bae leave already im sad ,stressed
6.35E+17,stop thinking im tire sneeze ,stressed
6.35E+17,prediction wellknown fact checker prove rinku sharma murder fault socalled news ,stressed
6.35E+17,looking video z sad couldnt see deploy ,stressed
6.35E+17,vocal line magical boy part 12 lie awake design ,stressed
6.35E+17,kung hei fat choi year ox associate hard work amp serenity sound relevant 2021 best celebrate lunar new year may bring good health amp prosperity ,stressed
6.35E+17,please help support sad movie add twibbon ,stressed
6.35E+17,text clock trauma factory 1 802 444 8311 ,stressed
6.35E+17,ugly nobody get model career taehyung im sick tire ,stressed
6.35E+17,sit amp think back far kang daniel come amaze bear mind neither suppo ,stressed
6.35E+17,eventually go stub toe hard surface go hurt lot happen ,stressed
6.35E+17,rest peace chick corea literally get music month ago thanks dad really sad hes go gonna take advantage period listen track ,stressed
6.34E+17,sad people one side shouldnt fight 1string stop act smug 2you ,stressed
6.34E+17,reimagining health amp care addressing medical amp institutional trauma remit create space marginalised ,stressed
6.34E+17,malcom marie terrible line wise emotion wise act wise fantastic im stress watch idk could talk way dog lol ,stressed
6.34E+17,trial sad life documentary wabbajack behold trial ,stressed
6.34E+17,like watch sad video make cry enjoy theatrics ,stressed
6.34E+17,tell shes pretty like rn prolly sad sum ,stressed
6.34E+17,taehyun say stay awake 40h yeonjuns joke become funny helppp ,stressed
6.34E+17,boy get slaughter helpless mother could scream father trauma stupid expect global n ,stressed
6.34E+17,need bring colorful pallette home back 2020s im tire white mute gray scheme want every ,stressed
6.34E+17,tidur 10 jam pun penat tidur 3 jam pun penat point dont know im tire sad ,stressed
6.34E+17,hurt sad break akihiko desperately need hug look haruki would never dare touch j ,stressed
6.34E+17,yeeehaww fellow companion sometimes yell see frightful finger make feel sad alexa play ring dang doo ,stressed
6.34E+17,yeah snapes death really sad want survive badly ,stressed
6.34E+17,dont sad watch tiger chasing butterflies ,stressed
6.34E+17,dont sad watch tiger chasing butterflies ,stressed
6.34E+17,awake get work 5am ,stressed
6.34E+17,need bring colorful pallette home back 2020s im tire white mute gray scheme want every ,stressed
6.34E+17,boy get slaughter helpless mother could scream father trauma stupid expect global n ,stressed
6.33E+17,im bit sad dont think friend know im back havent heard lot please retwee ,stressed
6.33E+17,try stay awake remember name everybodys changing dont feel ,stressed
6.33E+17,asexuals straight apart lgbt community bc theyre heterosexualtheyre hetero romantic tired n ,stressed
6.33E+17,sad rare find someone understand ,stressed
6.33E+17,got tired waiting wondering ever coming around faith faaaaaading met outskirts town said romeo save ive feeling alone keep waiting u never come lovestorytaylorsversion ,stressed
6.33E+17,boy get slaughter helpless mother could scream father trauma stupid expect global n ,stressed
6.33E+17,guys im get really tire wont matter acquit anyway comment thats reason ,stressed
6.33E+17,also wish werent awake right help three hour ,stressed
6.33E+17,1st one politician educate thev much knowledge cryptocurrency understand technology behind sectori think due lack knowledge political people country go back sad thing india ,stressed
6.33E+17,real im tire ,stressed
6.33E+17,s21epicmoments metrofm tired scar believe start food delivery service epic moments deserve capture ,stressed
6.33E+17,tired sage hour ffxiv ,stressed
6.33E+17,someday wonder would feel like happy point im numb pain im happy sad im j ,stressed
6.33E+17,ive literally spend quarter lockdown shaking ever imagine single soul touch damn thing sad thats take man realize shake isnt invitation anything ,stressed
6.33E+17,wanna watch last tatb movie right come im tired ,stressed
6.33E+17,young sad tire ,stressed
6.33E+17,dawg wanna draw hip subluxate incredibly painfully 2 whole second today god ,stressed
6.33E+17,acctualy glider might good thing buy really good pretty sad get flash tho ,stressed
6.33E+17,awake like weirdo ,stressed
6.33E+17,im fuking tire joke priv ,stressed
6.32E+17,im personally fan taylor swift love story reminds happy time childhood soothing thing rerecording yes awake time listen ,stressed
6.32E+17,time im tire get 230am everyday ,stressed
6.32E+17,fear awake anger beat loud face reality never charity enemy youre fight cover ,stressed
6.32E+17,see relationship care deeply change think would never ever change amp ,stressed
6.32E+17,rubinas journey video cute rubinav moments sad moment entertaining moment rubina fight rahul ,stressed
6.32E+17,awesome piece khadija khan sad state affair people quick call inequality amp injustic ,stressed
6.32E+17,south indians find rinkusharma irrelevant communal tension north india forget ramalingam ,stressed
6.32E+17,dont stop youre tire stop youre jyotikaistheboss ,stressed
6.32E+17,lord please release country shackle amapiano tire ,stressed
6.32E+17,incredibly tough year im moon call bar england amp wales today ,stressed
6.32E+17,short actually say youre rape apologistyou work mean youve make whole thing publicly shame oh noooo reality prove point btw lemming see one loan guy one sad like ,stressed
6.32E+17,give hug im tire drain ,stressed
6.32E+17,everythings mess rn aesos go scammer jskdndkskskd im tire ,stressed
6.31E+17,sexual tension ,stressed
6.31E+17,tired jhopeplazaclarocolombia ,stressed
6.31E+17,dont know whats copines make feel certain type way like nostalgic heartwarming make sad happy sad ,stressed
6.31E+17,think im sad share ,stressed
6.31E+17,medical abuse racism pls pls pls beg boost video bc sick tired black woman mi ,stressed
6.31E+17,week wear im tire care much little care cant stop would ,stressed
6.31E+17,sad ,stressed
6.31E+17,definitely actually im write sad fanfic ,stressed
6.31E+17,boy get slaughter helpless mother could scream father trauma stupid expect global n ,stressed
6.31E+17,thunk head wall im tire ,stressed
6.31E+17,blooming love job im glad half term today tire since day 1 even boris make even lockdown announcement happy half term ,stressed
6.31E+17,wanna sad dont time alevels2021 ,stressed
6.31E+17,sad dream house sell yall ive never see pretty house amp gonna buy amp bff gonna move w ,stressed
6.31E+17,week wear im tire care much little care cant stop would ,stressed
6.31E+17,immensely sad scene see someones life saving would wipe ,stressed
6.31E+17,janta demands abhinav tired speak ,stressed
6.30E+17,please shut lebron god sad hell cant keep name mouth ,stressed
6.30E+17,rubinas journey video cute rubinav moments sad moment entertaining moment rubina fight rahul ,stressed
6.30E+17,boy get slaughter helpless mother could scream father trauma stupid expect global n ,stressed
6.30E+17,hi whetever acc u remember acc acc go ,stressed
6.30E+17,taehyun say stay awake 40h yeonjuns joke become funny helppp ,stressed
6.30E+17,keep smile leave tension feel joy forget worry hold peace leave pain always happy ,stressed
6.30E+17,sad world focused whatever tf morgan wrong instead worry shit actually matter example thousand child go miss everyday find shortly late pornhub rap ,stressed
6.30E+17,daughter georgie say really sad part ,stressed
6.30E+17,taylor swift lie awake bed move album release clue around ceiling ,stressed
6.30E+17,im young stressed ,stressed
6.30E+17,sleep nice youre tire sad depress ,stressed
6.30E+17,lock liquidity bsc project someone help info kind tired scams bsc bnb defi binancesmartchain ,stressed
6.30E+17,prediction wellknown fact checker prove rinku sharma murder fault socalled news ,stressed
6.30E+17,9 tired like 6 hour learn 30 page relearn math ,stressed
6.30E+17,im still tire masterpiece best album 20202021 hard album beat record ,stressed
6.30E+17,beomgyu really refuse hug yeonjun sad ,stressed
6.30E+17,aries cancer libra capricorn information something thats make sad reveal soon w ,stressed
6.30E+17,david moses major risk factors lead girl ladies abuse drug lack parentchild communication academic pressures social pressures low selfesteem stress inability cope history trauma depression mental illnesses ,stressed
6.30E+17,im tire want ,stressed
6.30E+17,many hindu need kill wake take strict action protect whats rinku sharma wasnt first last continue ignore killing sad say old religious practice world danger ,stressed
6.30E+17,young sad tire ,stressed
6.30E+17,im taylor record music want im sad cause voice isnt obviously grown like sweetness young ,stressed
6.30E+17,day kicc alone rao wsr orengo must ignite civil unrest tell people march state house tired refrain use massage people shortcoming ,stressed
6.30E+17,officially divorce 5 minute ago know lot people say thing like congratulation view something ,stressed
6.30E+17,ordered happy meal still sad ,stressed
6.30E+17,omg baekhyun didnt see lucas comment end live thats sad ,stressed
6.30E+17,im tire asshole ,stressed
6.30E+17,confirm everyone feel tire time matter much sleep get caffeine consume also ,stressed
6.30E+17,jsls never fail amaze creativity sketch edits even appreciation word beau ,stressed
6.30E+17,tf happen army twitter could affect possibly dangerous explanation thread n ,stressed
6.29E+17,hey yallllll way early awake 743am orthodontist morning ,stressed
6.29E+17,321 bias bias wrecker skdhhfjfjskshfhjfks jooheon sad rn j ,stressed
6.29E+17,smile kid beautiful thing world feel sad see future generation study uncomfortabl ,stressed
6.29E+17,sad emoj nahi hain mary pas ,stressed
6.29E+17,parents child need care home significantly stressed lockdown rest population 12 ,stressed
6.29E+17,kaeya reason water flirt hes incredibly cunning charismatic know get people ,stressed
6.29E+17,sad story ,stressed
6.29E+17,im sad dont know ,stressed
6.29E+17,boy get slaughter helpless mother could scream father trauma stupid expect global n ,stressed
6.29E+17,8 year old trauma lose patient bring back 3 time hold son arm day cant ,stressed
6.29E+17,wide awake rn ,stressed
6.29E+17,wide awake bored af horny af ,stressed
6.29E+17,beomgyu really refuse hug yeonjun sad ,stressed
6.29E+17,im young stressed ,stressed
6.29E+17,ohh god sad please justiceforrinkusharma ,stressed
6.29E+17,see ehn im tiredif want form savage least understand first ,stressed
6.29E+17,oh im awake 5 second ,stressed
6.29E+17,hi whetever acc u remember acc acc go ,stressed
6.29E+17,sore swollen stress alya pink clay mask honestly fav mask love ,stressed
6.29E+17,month hard work preparation parent finally open store retweet would much appr ,stressed
6.28E+17,plan know may us many vote sad find ppl say havent vote ,stressed
6.28E+17,get disappoint hype amp response uppenna build start take 19movies al ,stressed
6.28E+17,quite sad today tomorrow good ,stressed
6.28E+17,hindu tired angry rinkusharma ,stressed
6.28E+17,tired work unapologetically insane ,stressed
6.28E+17,officially divorce 5 minute ago know lot people say thing like congratulation view something ,stressed
6.28E+17,superb support best fan world need best city world ill match 10k wit ,stressed
6.28E+17,im stress please send favorite piece calm medium ,stressed
6.28E+17,come bitch sad hell ,stressed
6.28E+17,sad realize lot ppl think hardearned longterm retirement saving gift ,stressed
6.28E+17,get tired wait wonder ever come around faith fade meet outskirt town ,stressed
6.28E+17,awake lets trend tag erica youtube ericatheclout ericatheclout ,stressed
6.28E+17,ugh dumb thing wont open phone sad ,stressed
6.28E+17,honestly im tire know im ,stressed
6.28E+17,pray shri rama rinkus sadgati tire even react weve see ankit saxena ramalingam several othe ,stressed
6.28E+17,lord forgive prepare enter reckless era im tired ,stressed
6.28E+17,im guess nobodys awake send freaky friday pic ,stressed
6.28E+17,wasnt awake enough damn sound useful ,stressed
6.28E+17,mum watch stag without sad betray ,stressed
6.28E+17,kinda sad someone gonna spend valentine without ,stressed
6.28E+17,covid19 pandemic stress critical role womeninscience one woman put effort k ,stressed
6.28E+17,arent tire one piece soundtrack since begin 1000 episode ,stressed
6.28E+17,please help support sad movie add twibbon ,stressed
6.27E+17,reopen student please dont reopen stress need pas please postpone school reopen ,stressed
6.27E+17,buzz get mclaren ricardo merchandise today im sad know bring papaya orange ts caps ,stressed
6.27E+17,awake past listen clairo midnight cry ,stressed
6.27E+17,quarantine literally bad bc run book read im literally sad ,stressed
6.27E+17,sad watch dcj zondo evidence leader try shift focus onto guptas ignore real cul ,stressed
6.27E+17,awake epiphany jhopeplazaclarocolombia ,stressed
6.27E+17,mint chocolate ice cream good im tire people act like ,stressed
6.27E+17,noo sad ,stressed
6.27E+17,luo counterpart baba sad smh ,stressed
6.63E+17,rush dont class tomorrow realise cuh theyre right time sex say watch scroll twitter 4 hour say youre tire laugh haha yeah sigh ,stressed
6.63E+17,go college experience get trauma ,stressed
6.63E+17,people lose sleep thanks military night flight ,stressed
6.63E+17,dont sad watch tiger chasing butterflies ,stressed
6.63E+17,sad tho need uninstall rhythm hive jhopeplazaclarocolombia ,stressed
6.63E+17,find someone know love youre sad ,stressed
6.63E+17,keep heart awake colorful silence claude monet photo abandoned inn japan photo thi ,stressed
6.63E+17,ever get scared get happy everytime youll end sad ,stressed
6.63E+17,job everyday sad true true racism scourge society find abhorrent say think world get good see america engrained ever even push long way go though ,stressed
6.63E+17,tf happen army twitter could affect possibly dangerous explanation thread n ,stressed
6.63E+17,sad gurl hour ,stressed
6.63E+17,ok pseudovictorian setting need character lead character b cave quickly drag wrist probably wouldnt seem proper brain pick brain sack potato launch belligerent sexual tension pick ,stressed
6.63E+17,youre probably tire hear cry ,stressed
6.63E+17,woah make kinda sad lmao ,stressed
6.63E+17,insomnia hem babe ,stressed
6.63E+17,right itlet add sad nigga hour playlist ,stressed
6.63E+17,warren pond eppingforest please take care near frozen pond time incredibly dangerous step onto ice also important keep dog close control walking area frozen pond thank staysafe ,stressed
6.63E+17,downplaying twist happen case obvious reason prevent escalation sad state affair ,stressed
6.63E+17,love make sad ,stressed
6.63E+17,us little guy try lol unelated note recruiter reach today say tire top search result linkedin finally reach despite great fit role thanks linkedin series ,stressed
6.63E+17,cardio 15003000 skip im tire abeg want something else ,stressed
6.63E+17,hi siara sheher dont speak eng good cause country eng different world try hard sorry fandomsnot honest 100 mairuma mxtx novel dstone genshin impact bnha hxh homestuck evangelion twist wonderland ,stressed
6.62E+17,yeah im get bout tire tell mf favorite color ,stressed
6.62E+17,hurt sad break akihiko desperately need hug look haruki would never dare touch j ,stressed
6.62E+17,aksa awake hour hasnt go sleep yet kind thing make want fight ,stressed
6.62E+17,eye tired brain tired pretty tire ,stressed
6.62E+17,get tire ,stressed
6.62E+17,trauma strong one ,stressed
6.62E+17,go home happy cute day end sad anyway brain use ,stressed
6.62E+17,good morning dear friend happy friday always make day awake kind word thankyou much never enough appreciate kindness ,stressed
6.62E+17,please help support sad movie add twibbon ,stressed
6.62E+17,nonono dumb tire probably ,stressed
6.62E+17,trauma experience wisdom ,stressed
6.62E+17,wanda say cant reverse death matter sad make us felt soul ,stressed
6.62E+17,awake late night full long ,stressed
6.62E+17,everyone feel sad rn need something nice ,stressed
6.62E+17,picture really trigger emotion im really sad think please tell im wrong lg take care stay healthy ,stressed
6.62E+17,know achievement lover boy j read per tuzakijahangiri 1 womeniser ,stressed
6.62E+17,boy get slaughter helpless mother could scream father trauma stupid expect global n ,stressed
6.62E+17,pls quit treat ur hot girlfriend like shit make sad ,stressed
6.62E+17,please help support sad movie add twibbon ,stressed
6.62E+17,sexual tension desire move new zealand ,stressed
6.62E+17,sad really like feeling confuse time chillllin figurin back ,stressed
6.62E+17,find someone know love youre sad ,stressed
6.62E+17,holiday today study pathology quiz synchronous lecture im tire suppose break ,stressed
6.62E+17,sad wow ,stressed
6.62E+17,pray shri rama rinkus sadgati tire even react weve see ankit saxena ramalingam several othe ,stressed
6.62E+17,sad realize lot ppl think hardearned longterm retirement saving gift ,stressed
6.62E+17,almost 3am im bout beat dick go bed 5 hour game session dont judge im tire woman already get kid young dumb fun keep grinding ,stressed
6.62E+17,month hard work preparation parent finally open store retweet would much appr ,stressed
6.62E+17,unpopular opinion hard write testable easy maintain workflow ,stressed
6.62E+17,mfrs make bad person bad sad ,stressed
6.62E+17,friendly reminder okay feel sad make right decision ,stressed
6.62E+17,gentle elder didnt privilege healing even acknowledge experience trauma ,stressed
6.62E+17,moment read original hny synopsis make sad af girl grow without parent esp moroh ,stressed
6.61E+17,sad truth ,stressed
6.61E+17,tire hoe im tire hoe haha single 3 hour know ill ,stressed
6.61E+17,think team great job although sad se ,stressed
6.61E+17,sit amp think back far kang daniel come amaze bear mind neither suppo ,stressed
6.61E+17,boy get slaughter helpless mother could scream father trauma stupid expect global n ,stressed
6.61E+17,thats close maybe catholic school cause sad self harm vs primal public school rage ,stressed
6.61E+17,new song upside lt3 trauma factory 219 ,stressed
6.61E+17,smile kid beautiful thing world feel sad see future generation study uncomfortabl ,stressed
6.61E+17,awake night describe bad back pain ive ever experience sos ,stressed
6.61E+17,never get tire ,stressed
6.61E+17,young sad tire ,stressed
6.61E+17,im tire literally wanna cry ,stressed
6.61E+17,incredibly beautiful ,stressed
6.61E+17,uppena good first half decent second half hard hit amp emotional climax debut fil ,stressed
6.61E+17,leah jenner im kinda sad ,stressed
6.61E+17,tell shes pretty like rn prolly sad sum ,stressed
6.61E+17,didnt put lotion bath know gonna cause break im simply tire care ,stressed
6.61E+17,month hard work preparation parent finally open store retweet would much appr ,stressed
6.61E+17,tired sage hour ffxiv ,stressed
6.61E+17,one thing western entertainment industry even antismantis etc hard press deny bh amp h ,stressed
6.61E+17,yall really sad valentines daywhat happen real bitch give fuck bout nigga big birkin bag hold five six figure steven ,stressed
6.61E+17,tired vision obstruction want best contact lens market get ready focus rapidsnetwork click ,stressed
6.61E+17,dream punch dad name elephant quiet sad ,stressed
