post_id,tweet_text,status
5.88E+17,imagine reason barbaras voice sound worn tire feel weight try protect ,stressed
5.88E+17,may know know survivor highly likely survivors trauma close peo ,stressed
5.88E+17,close die january 6 aoc trauma share ,stressed
5.88E+17,james corden act gay two hour get golden globe nomination act straight 23 year get ,stressed
5.88E+17,dont know real man know mature confident welladjusted adult human man doesnt minimize trauma woman doesnt trivialize suffering doesnt tell arent pain say ,stressed
5.88E+17,okay im make yall feel good yes enha may meet fan irl first time experience live first time ever well experience thing fan future couldnt dont sad ,stressed
5.88E+17,tire say ok ,stressed
5.88E+17,oh nooooo thats sad ,stressed
5.88E+17,im sorry everyone whose louis show get postpone also im sad louis say many time perf ,stressed
5.88E+17,sad thing disinformation truth come damage already people already mi ,stressed
5.87E+17,people dont like see anyone good people dont like someone sad ,stressed
5.87E+17,im already incredibly tense stress read fanfic something terrible happen one faves definitely stress ,stressed
5.87E+17,may know know survivor highly likely survivors trauma close peo ,stressed
5.87E+17,whole fat isnt healthy thing tire honestly pretty bore telling fat people theyre go ,stressed
5.87E+17,nationalwomeninsportsday want highlight coowner bj mcleod motorsports incredibly hardworking examplesetting woman maledominated sport thank jessica ,stressed
5.87E+17,may know know survivor highly likely survivors trauma close peo ,stressed
5.87E+17,well sad aint cheeky ,stressed
5.87E+17,watch grave firefly dis shit sad asf ,stressed
5.87E+17,surrender hotel lay red carpet mark boucher unhappy australia postpone satour ,stressed
5.87E+17,tension ,stressed
5.87E+17,survivor trauma worry believe situation wasnt bad enough bad fear ,stressed
5.87E+17,survivor trauma worry believe situation wasnt bad enough bad fear ,stressed
5.87E+17,im sad im try make header different work ,stressed
5.87E+17,men sad relationship ruin ,stressed
5.87E+17,sad thing disinformation truth come damage already people already mi ,stressed
5.87E+17,james corden act gay two hour get golden globe nomination act straight 23 year get ,stressed
5.87E+17,hear lot talk real man dont know real man know mature confide ,stressed
5.87E+17,tire cry ,stressed
5.87E+17,sad bc hes tiny cute baby h anyone ,stressed
5.87E+17,alexandriaocasiosmollett actual fuck wrong people still complex ge ,stressed
5.87E+17,listening frank ocean im sad isnt sit right system ,stressed
5.87E+17,anyone else get stress easy task procrastinate finally youre like oh th ,stressed
5.87E+17,sad thing disinformation truth come damage already people already mi ,stressed
5.87E+17,sad thing disinformation truth come damage already people already mi ,stressed
5.87E+17,take 10 minute thats come sad ,stressed
5.87E+17,may know know survivor highly likely survivors trauma close peo ,stressed
5.87E+17,sad thing disinformation truth come damage already people already mi ,stressed
5.87E+17,lol nobody rig anything one many trump use exploit lead rabbit hole believe every fear monger thing tell sad ,stressed
5.87E+17,always see people quit right theyre gonna join team theyre grind sad ,stressed
5.87E+17,irony amaze reading comprehension isnt fortay bye kid fun upset dont graso subject pretend actually evidence support belief thats tragically sad ,stressed
5.87E+17,sachin tendulkar tennis elbow injury sad know affect spine ,stressed
5.87E+17,sad thing disinformation truth come damage already people already mi ,stressed
5.87E+17,day go well boom see whyte ppl wilding im tired bro ,stressed
5.87E+17,sorry dedicated hardworking americans make weld thrive live several yr hubby get phd tire smell money feedlot tiring seeing underpaid mexicans work field worse see mere coin leave hand food store ,stressed
5.87E+17,may know know survivor highly likely survivors trauma close peo ,stressed
5.87E+17,im tire storyline dont think actually break ,stressed
5.87E+17,girl go sit office today bc tire email sick ,stressed
5.87E+17,hashtag use right disparage reprehensible rhetoric make survivor traum ,stressed
5.87E+17,stream tired exhausted still ,stressed
5.87E+17,please call press conference state fact tired bein ,stressed
5.87E+17,yall im sad finally gonna able watch manhunt premiere move friday work friday smh ,stressed
5.87E+17,ive decide im gonna absolutely focus need feel incredibly free ,stressed
5.87E+17,rip disney empire sad hillbillyland control ,stressed
5.87E+17,im tire driving honestly dont wanna leave house anymore ,stressed
5.87E+17,sad true ,stressed
5.87E+17,sad yall think yall gotta wear designer look cute raw outfit yall cant dress amp show fr ,stressed
5.87E+17,annoying stay awake time fund account wait nba special pick game difficult send code still deny bet stay village oo ,stressed
5.87E+17,im really tire therapist office everyone work late actually annoy hell make feel like cant confident yall even help cant even keep schedule properly ,stressed
5.87E+17,yall im sad ,stressed
5.87E+17,ever draft something incredibly cunty look back like damn day gal ,stressed
5.87E+17,really understand complicate end complete failure gop go pay moral weakness sad ,stressed
5.87E+17,tire people reduce black panther party free meal programthey vanguard political life ,stressed
5.87E+17,sad thing disinformation truth come damage already people already mi ,stressed
5.87E+17,im sad covid waste one hot year im gonna hot die ,stressed
5.87E+17,men sad relationship ruin ,stressed
5.87E+17,circling back check homophobic slur use white house staff journos awake four year ,stressed
5.87E+17,sad thing disinformation truth come damage already people already mi ,stressed
5.87E+17,every local election get sad dont cool vote sticker pin heres one make year ago laugh ,stressed
5.87E+17,many woman sexual assault part american experience recognize trauma ,stressed
5.87E+17,may know know survivor highly likely survivors trauma close peo ,stressed
5.87E+17,sad biological men compete woman sport hell confirm bidens ed secretary elections consequence ,stressed
5.87E+17,shes tire let show begin ,stressed
5.87E+17,really hard stay sad 6 cat house ,stressed
5.87E+17,im nude dindu nuffin ,stressed
5.87E+17,im tire people say republicans act fear trump white privilege statement ,stressed
5.87E+17,james corden act gay two hour get golden globe nomination act straight 23 year get ,stressed
5.87E+17,sad thing disinformation truth come damage already people already mi ,stressed
5.87E+17,sad thing disinformation truth come damage already people already mi ,stressed
5.87E+17,tire liberals amp ndp heterophobia christianphobia caucasophobia amp allodoxaphobia see libera ,stressed
5.87E+17,sad thing disinformation truth come damage already people already mi ,stressed
5.87E+17,sad thing disinformation truth come damage already people already mi ,stressed
5.87E+17,making fun trauma survivor good look ,stressed
5.87E+17,talk okay maybe tire little bit ,stressed
5.87E+17,hysterical permanent resident trumps anus dementia sad thing watch ,stressed
5.87E+17,sad thing disinformation truth come damage already people already mi ,stressed
5.87E+17,sad thing disinformation truth come damage already people already mi ,stressed
5.87E+17,sad thing disinformation truth come damage already people already mi ,stressed
5.87E+17,part sad go part glad cousin get smooth defender play behind pitching ,stressed
5.87E+17,happen pick nose automatic cancel asking friend realsies though facecam mean incredibly conscientious youre time like scratching boob fix wedgie leave room ,stressed
5.87E+17,sad thing disinformation truth come damage already people already mi ,stressed
5.87E+17,today sad day ,stressed
5.87E+17,put let blunt know incredibly serious like powerpoint slide ,stressed
5.87E+17,gm besties awake ,stressed
5.87E+17,im tire instagram ,stressed
5.87E+17,tired trope shes lie violence abuse ,stressed
5.87E+17,rant make sad bc im think ,stressed
5.87E+17,yoongi try find namjoon cut reaction im sad ,stressed
5.86E+17,dont get tired take deep water ,stressed
5.86E+17,nvm get tire already ,stressed
5.86E+17,sad thing disinformation truth come damage already people already mi ,stressed
5.86E+17,incredible sad animation show tagged blue whale movement blue dot dodge shipping traffic ,stressed
5.86E+17,im gonna say theres something incredibly antipoor government consistently choose bail fai ,stressed
5.86E+17,sad thing disinformation truth come damage already people already mi ,stressed
5.86E+17,attempt retrieve mobile device 2fa method enabling 2fa serf incredibly helpfu ,stressed
5.86E+17,sad thing disinformation truth come damage already people already mi ,stressed
5.86E+17,dont even sound sad lmao ,stressed
5.86E+17,im tired ,stressed
5.86E+17,dude weak chin around incredibly quick way kinda deserve wouldve reaction would kerb stomp least know anymore ,stressed
5.86E+17,sad thing disinformation truth come damage already people already mi ,stressed
5.86E+17,fyi 1 certain type food instigate know eat purpose video ,stressed
5.86E+17,im tire people say republicans act fear trump white privilege statement ,stressed
5.86E+17,hard sweet worth two theyre baby ,stressed
5.86E+17,best harvest moon game amp im tire pretend social ,stressed
5.86E+17,hashtag use right disparage reprehensible rhetoric make survivor traum ,stressed
5.86E+17,pretty sad lego mando doesnt face helmet ,stressed
5.86E+17,theres also nothing wrong empathize aocs assert trauma ,stressed
5.86E+17,reminder follow support artist ig hes racist sexist homophobic hes say thing wa ,stressed
5.86E+17,sad thing disinformation truth come damage already people already mi ,stressed
5.86E+17,sad thing disinformation truth come damage already people already mi ,stressed
5.86E+17,men sad relationship ruin ,stressed
5.86E+17,idk feel bad like bad start use scratch didnt want scar ive cut blade everyday since last friday feel tired want stop ,stressed
5.86E+17,social distancing selfisolated stressed learn relax book stress harmful health new kindle ebook help dramatically reduce stress life help live long free kindle unlimited ,stressed
5.86E+17,sad thing disinformation truth come damage already people already mi ,stressed
5.86E+17,new covidvaccine clinic live today people maine keep supply come colleague work hard get n run community interest get vaccinated remain high ,stressed
5.86E+17,sad day american people common sense ask question relief effort gong fund pay back country must live within mean like family must balance checkbook ,stressed
5.86E+17,changkyuns solo work mbbs make great success would make incredibly happy cause really deserve ,stressed
5.86E+17,roberto firmino wowincredibly shite ,stressed
5.86E+17,erica banks little buzz buss way could think capitalize dance tory lanez ,stressed
5.86E+17,sad thing disinformation truth come damage already people already mi ,stressed
5.86E+17,sad news fec buhari approve establishment 20 new private universities job create topfa ,stressed
5.86E+17,hun black speaking justin owed acceptikn apology isnt topic speak dont care deal aftermath black ppl forgive im fkn tired ppl speaking behalf ,stressed
5.86E+17,sad thing disinformation truth come damage already people already mi ,stressed
5.86E+17,incredibly thorough look cosmic unity homie super excite thing man ,stressed
5.86E+17,may know know survivor highly likely survivors trauma close peo ,stressed
5.86E+17,sad ghost ,stressed
5.86E+17,sad watch movie call 5 7 terrific recommend havent see ,stressed
5.86E+17,even fantastical element give story follow certain logic certain r ,stressed
5.86E+17,im apologize distant middle deadly global pandemic fighting burnout insomnia ,stressed
5.86E+17,ive watch enemy gate dont know many time dont get tire third fourth year im watching ,stressed
5.86E+17,yes apply artist yall love cancel every chance yall get im tire hear cant listen artist anymore bc sum b say learn separate art artist ,stressed
5.86E+17,exactly im tire slander ,stressed
5.86E+17,good person imagine sad must miss baby week miscarry still think baby today old would might look like personality would like im sorry loss ,stressed
5.86E+17,im sad drew lil meow meow ,stressed
5.86E+17,feel beautiful woman sad ,stressed
5.86E+17,sad thing disinformation truth come damage already people already mi ,stressed
5.86E+17,woman craft respectful beautifully write incredibly careful email youve work age gently ques ,stressed
5.86E+17,luciferians trauma base mind control use remote neural monitoring 247 surveillance force psychiatry call human trafficking hotline perps induce psychosis try murder ,stressed
5.86E+17,sick tire ,stressed
5.86E+17,miss use go gym im really sad cant ,stressed
5.86E+17,get tire shipper downplay bakugous character develop ship 1 bakugous development ,stressed
5.86E+17,im sad say product like s4 6gb 64gb model scam got phone 14th november 2019 phone crash january 22 2021 still regret go product first place ,stressed
5.86E+17,shout incredibly talented woman organization ngwsd ,stressed
5.86E+17,sad thing disinformation truth come damage already people already mi ,stressed
5.86E+17,want sleep im tire everything ,stressed
5.86E+17,jus tire wbu ,stressed
5.86E+17,levi hows childhood trauma okay show emotion come go dont im start think use sarcasm nothing else tell youre always verge break act like dont care prob care much ,stressed
5.86E+17,maybe klopp 1 mentality physically tire team selection tactic nowadays plan b ,stressed
5.86E+17,sad thing disinformation truth come damage already people already mi ,stressed
5.86E+17,stress tired bored answer go try make creative danity http ,stressed
5.86E+17,sad thing disinformation truth come damage already people already mi ,stressed
5.86E+17,men sad relationship ruin ,stressed
5.86E+17,guy ever get tire talk good go future 8 year ultimate po ,stressed
5.86E+17,thank much corey provide us explanation meaning behind incredibly beautiful fa ,stressed
5.86E+17,tire ,stressed
5.86E+17,tired feel like ,stressed
5.86E+17,survivor trauma worry believe situation wasnt bad enough bad fear ,stressed
5.86E+17,exactly another sad amp disappoint abc lead attack labor party transparent ,stressed
5.86E+17,knowing youre gonna try stuff basic vore cool wendigo gf sad cool idea wanna go ,stressed
5.86E+17,dont get mad get sad ,stressed
5.86E+17,sad thing disinformation truth come damage already people already mi ,stressed
5.86E+17,im 22 im finna sit around sad amp miserable shit cant get year back ima make count ,stressed
5.86E+17,say stay imma call ive awake 4 day ,stressed
5.86E+17,tire people reduce black panther party free meal programthey vanguard political life ,stressed
5.86E+17,someone go first tournament 13 age divide bracket would kinda sad really dont think itd w ,stressed
5.86E+17,teach kid read math im tire crusade btw bias asian ame ,stressed
5.86E+17,survivor trauma worry believe situation wasnt bad enough bad fear ,stressed
5.86E+17,sounds incredibly interesting ,stressed
5.85E+17,sad whats happen jmo coaching huge issue talent decision making expect move mostly bc decision ,stressed
5.85E+17,actually criminal recognize michaela coel w trauma sexual assault consent w ,stressed
5.85E+17,james corden act gay two hour get golden globe nomination act straight 23 year get ,stressed
5.85E+17,swear point script im try finish nothing one long session full sexual tension record know go need specific tone voice ,stressed
5.85E+17,tired tear ,stressed
5.85E+17,sad thing disinformation truth come damage already people already mi ,stressed
5.85E+17,always tire never sleep ,stressed
5.85E+17,name lady g incredibly offensive idgaf anyone say ,stressed
5.85E+17,feel sad rakhi sisters love ,stressed
5.85E+17,one day man ima sleep simply wake im tire ,stressed
5.85E+17,trauma aoc ,stressed
5.85E+17,sad thing disinformation truth come damage already people already mi ,stressed
5.85E+17,sad aboutt people amazon ,stressed
5.85E+17,sad thing disinformation truth come damage already people already mi ,stressed
5.85E+17,attempt retrieve mobile device 2fa method enabling 2fa serf incredibly helpfu ,stressed
5.85E+17,also cant really guarantee nice next time ask someone untag im tire ,stressed
5.85E+17,listen sad music im already sad make even sad ,stressed
5.85E+17,say jasmin still say bad rubina rubina still soft corner ,stressed
5.85E+17,feel know awake know hollywood full pedophile luciferians dont care fall face earth ,stressed
5.70E+17,working tension last week ,stressed
5.70E+17,fr im tire ppl use ur oppas insult ,stressed
5.70E+17,sad thing disinformation truth come damage already people already mi ,stressed
5.70E+17,im 22 im finna sit around sad amp miserable shit cant get year back ima make count ,stressed
5.70E+17,tire day ,stressed
5.70E+17,watch freak geek wish long part freak gang wish friend im sad rn ,stressed
5.70E+17,im sad attackontitan shingekinokyojin mikasaackerman ,stressed
5.69E+17,also come across sad ,stressed
5.69E+17,im tired ,stressed
5.69E+17,im 22 im finna sit around sad amp miserable shit cant get year back ima make count ,stressed
5.69E+17,personal tdsb prediction four week happy kid stress teacher happierstressed parent follow new lockdown ,stressed
5.68E+17,men sad relationship ruin ,stressed
5.68E+17,oh look phi ,stressed
5.68E+17,sad thing disinformation truth come damage already people already mi ,stressed
5.68E+17,tired last night sleep thru 11 alarmsjesus ,stressed
5.68E+17,daughter 20 yo speak training day judges cafcass familycourt staff force contact father w ,stressed
5.68E+17,sad see go man thanks youve chicago ,stressed
5.67E+17,current 1125 gap no1 please collect silver stars starpass vote tension boy park jeongwoo ,stressed
5.67E+17,survivor trauma worry believe situation wasnt bad enough bad fear ,stressed
5.67E+17,sad disappointed petty envious disgruntle judgmental emotionally stunted people world idea vast number start hang twitter pathetic lot sure cant spare iota pity ,stressed
5.67E+17,sad thing disinformation truth come damage already people already mi ,stressed
5.67E+17,tire im mentally ill wire im neuroatypical inspire god nerf keep meta fair ,stressed
5.67E+17,sad ,stressed
5.67E+17,anyone stay awake long two hour ,stressed
5.66E+17,sad republicans cant back bill help americans bad plague hundred year tandem tankin ,stressed
5.66E+17,men sad relationship ruin ,stressed
5.66E+17,yoongi try find namjoon cut reaction im sad ,stressed
5.66E+17,u kno ur fall asleep u go bed soon lay ur completely awake ,stressed
5.66E+17,protest fascism favor civil right blm different protest ,stressed
5.66E+17,sad thing disinformation truth come damage already people already mi ,stressed
5.66E+17,funny tell im sad boy bitch think im use drug ,stressed
5.66E+17,sad thing disinformation truth come damage already people already mi ,stressed
5.65E+17,survivor trauma worry believe situation wasnt bad enough bad fear ,stressed
5.65E+17,thread u stress animation show 1 difficult week life 1 whale blue dot 1 whale ,stressed
5.65E+17,thats long time wash hair least twice week wash shower hard dry shampoo totally help please stop put oil hair hair naturally oily dont need ,stressed
5.65E+17,ah traumatized afraid go diecmon alex serve stigmatization true victim trauma aoc histrionic political acting cause division seriously think ashamed ,stressed
5.65E+17,sad see many people comment knowledge case law yet insist murderer guy tv tell ,stressed
5.65E+17,im sad cant watch stream anymore look like ill rely tl sebastian content ,stressed
5.65E+17,sad thing disinformation truth come damage already people already mi ,stressed
5.65E+17,brother send trust thing snap n find sad didnt even wanna tag cause people snap would creepy ,stressed
5.64E+17,may know know survivor highly likely survivors trauma close peo ,stressed
5.64E+17,watching feel sort way shocked beyond belief sad feel proud leah rest people fight way madness loss word speechless feel like every person watch ,stressed
5.64E+17,get move youre sensitive bad word utter survivor trauma ,stressed
5.64E+17,557 christine queens people ive sad ,stressed
5.64E+17,kinda sad people perceive graduate study mean promotional purpose paginitan pa jd haha help ,stressed
5.63E+17,wanna go spouse house tire mine plus cold maaayne ,stressed
5.63E+17,yknow normalise fandom creator rting work order gain attention people embarras ,stressed
5.63E+17,sad thing disinformation truth come damage already people already mi ,stressed
5.63E+17,sad thing disinformation truth come damage already people already mi ,stressed
5.63E+17,survivor trauma worry believe situation wasnt bad enough bad fear ,stressed
5.63E+17,sad thing disinformation truth come damage already people already mi ,stressed
5.63E+17,hard control fever day fine small symptom week headache 2nd dose feb 18th ill fill symptom point tell bc covid prior symptom could bad covid ,stressed
5.62E+17,quick jesterwearingacorset drawing commission im stress shes comfort character ,stressed
5.62E+17,get sad see empty park lot alexandriaocasiosmollett ,stressed
5.62E+17,sum fan really question iu didnt win showchamp today let u digital criterion gol ,stressed
5.62E+17,really baby father tryna claim bm amp thats cant kid rn lmao sad ,stressed
5.62E+17,today nationalwomenphysiciansday pic dr right graduation ,stressed
5.62E+17,hes incredibly effective maybe consider say shit like right isnt help anyone election hes great ally biden focus work together love thats good ,stressed
5.62E+17,tired af ,stressed
5.61E+17,sad thing disinformation truth come damage already people already mi ,stressed
5.61E+17,actually tire use ,stressed
5.61E+17,leave note box knock quit knock tire people work midnight cuss lol ,stressed
5.61E+17,kefla tire gokus bs ,stressed
5.61E+17,yeah tour new school hassle sm hw like 10x harder bc im tired ahhh im rly complain bad u know u ,stressed
5.60E+17,legendary sasavi mount incredibly rare drop ,stressed
5.60E+17,tired ,stressed
5.60E+17,may know know survivor highly likely survivors trauma close peo ,stressed
5.60E+17,hurry hole tire racist ignorant ,stressed
5.60E+17,sad thing disinformation truth come damage already people already mi ,stressed
5.60E+17,sad thing disinformation truth come damage already people already mi ,stressed
5.59E+17,james corden act gay two hour get golden globe nomination act straight 23 year get ,stressed
7.19E+17,bye liked pls tell knew u saw u would say planned whole reply like actually jungkook omg bye sound bored sad ,stressed
7.19E+17,happy see new administration take first step forward say every day child separate parent co ,stressed
7.19E+17,definitely think viable strategy issue find unless firmly establish snow drafter end fall apart hard come together powerful thing ,stressed
7.18E+17,know argument valid reason tire momlife adulting kidmemes letterbaords letterboardquotes mommemes meme funnymemes letterboardsofinstagram san diego california ,stressed
7.18E+17,im sad covid waste one hot year im gonna hot die ,stressed
7.18E+17,tired respond ,stressed
7.18E+17,survivor trauma worry believe situation wasnt bad enough bad fear ,stressed
7.18E+17,podcast go detail situation surprising really sad think length theyd go hold us back ,stressed
7.18E+17,youre incredibly racist ,stressed
7.18E+17,well incredibly awful cursed entirely predictable really ,stressed
7.18E+17,fucking sad stupid alexandriaocasiosmollett ,stressed
7.18E+17,isnt sad people significant become one name instastory ,stressed
7.18E+17,hate monster hunter winter whatever first time play series sad ,stressed
7.17E+17,personal tdsb prediction four week happy kid stress teacher happierstressed parent follow new lockdown ,stressed
7.17E+17,please please please everyone pray daughter molly accident suffer brain trauma ,stressed
7.17E+17,sexual assault trauma dont know ill say right go psa talk sexual assault negatively charge term like disgust amp horrible end read globally apply survivor well perpetrator use term 12 ,stressed
7.16E+17,im tire keep go gn brodolo ,stressed
7.16E+17,tired covid ,stressed
7.16E+17,may know know survivor highly likely survivors trauma close peo ,stressed
7.16E+17,bore twitter break twitter sad twitter happy twitter hungry twitter walang kausap twitter walang kachat twitter ,stressed
7.16E+17,sad thing disinformation truth come damage already people already mi ,stressed
7.16E+17,perodn ahi ever kill cop n capitol aurthories sayimg easy pin piont killer say pepper spay might contribute assult sad ine charge say give time prbly two week time ,stressed
7.16E+17,sad thing disinformation truth come damage already people already mi ,stressed
7.15E+17,cant believe actually get tired 12pm sleep time day ,stressed
7.15E+17,gods white mean girl act didnt yall grow high school sad ampgross know tha ,stressed
7.15E+17,im sad covid waste one hot year im gonna hot die ,stressed
7.14E+17,super tired ,stressed
7.14E+17,thats sad suspect also entirely true ,stressed
7.13E+17,shoutout animator friend industry thank hard work provide us content watch animation ,stressed
6.66E+17,cant wait find person tired start ,stressed
6.66E+17,sad thing disinformation truth come damage already people already mi ,stressed
6.66E+17,im tire people say republicans act fear trump white privilege statement ,stressed
6.66E+17,may know know survivor highly likely survivors trauma close peo ,stressed
7.17E+17,thats nice tired work thank im visit sister bit great evening good day tomorrow ,stressed
7.17E+17,sad ill wait watch dont worry ,stressed
