post_id,tweet_text,status
5.52E+17,well personally never really like mlp reboot g4 give credit credit due mlp end pretty good note thomas kind sad mattel treat property well ,stressed
5.52E+17,today wear white buttondown im tire want think im finally wear ,stressed
5.52E+17,im sad goodbye ,stressed
5.52E+17,sad day someone dedicate factual reporting leave country protect thug dems ,stressed
5.52E+17,im sorry loss lose love one always incredibly difficult take time grieve ,stressed
5.52E+17,wonder im tire time ,stressed
5.52E+17,absolutely hate idea well someone else bad like ur pain trauma completely valid despite ,stressed
5.52E+17,new documentary womans work examine harassment ogling incredibly low pay nfl cheerleader receive ,stressed
5.52E+17,yeah sad guy chance survive ,stressed
5.52E+17,whats food slander im sad ,stressed
5.52E+17,marked alitas character little sad hugos death main concern whether sequel ,stressed
5.52E+17,sad lol ,stressed
5.52E+17,long sad ,stressed
5.52E+17,feel like im start scratch every aspect life kinda sad kinda powerful kinda necessary ,stressed
5.52E+17,sad newscloris insanely talented could make laugh cry drop hat always pleasure ,stressed
5.52E+17,sad newscloris insanely talented could make laugh cry drop hat always pleasure ,stressed
5.52E+17,sad newscloris insanely talented could make laugh cry drop hat always pleasure ,stressed
5.52E+17,god episode 20 start sad note ,stressed
5.52E+17,jugyeong say tire suho give piggyback ride want lee suho boyfriend truebeauty ,stressed
5.52E+17,valid im sad ,stressed
5.52E+17,yoongi extremely stress run episode 126 ,stressed
5.52E+17,hey anyone believe douglass mackey aka ricky vaughn go keep mouth shut coconspirator sa ,stressed
5.52E+17,come take im tire ,stressed
5.52E+17,oh sad ,stressed
5.52E+17,still awake ,stressed
5.51E+17,finish flower evil like yesterday think forget im sad end literally expect ,stressed
5.51E+17,wake still cry couple hour everyday trauma real ,stressed
5.51E+17,v move yesterday push cart block really tired thank lani aaa ,stressed
5.51E+17,thanks aha however diagnose mental illness experience massive trauma 3yrs present go catholic primary school pray every night come im atheist thank word good intention ,stressed
5.51E+17,sad newscloris insanely talented could make laugh cry drop hat always pleasure ,stressed
5.51E+17,common sense 1precious therapist trait 2very hard teach 3often ruin train program thatemphasize jargon ,stressed
5.51E+17,feel like im start scratch every aspect life kinda sad kinda powerful kinda necessary ,stressed
5.51E+17,sexual tension parish lydia ,stressed
5.51E+17,sad hear cloris leachmans pass little known fact cast original production arthur millers ,stressed
5.51E+17,also youre feeling sad whole situation im tell feeling valid youre selfish fo ,stressed
5.51E+17,ever since debut weve always tomoon concert broadcast look back time seem like ,stressed
5.51E+17,yeah fun story seem overwhelmingly likely sad end ,stressed
5.51E+17,feel like im start scratch every aspect life kinda sad kinda powerful kinda necessary ,stressed
5.51E+17,made guy something ,stressed
5.51E+17,horrifying officer suppose help calm student incredibly dysregulated ,stressed
5.51E+17,plenty exmuslims leave religion due personal trauma dont go become genocidal maniac nothing ever go excuse kind misery want inflict million people ,stressed
5.51E+17,noticing interesting similarity number sport metaphor use church business class yeah definitely religious trauma involve right right ,stressed
5.51E+17,brokenhearted meet week ago kind shes one people whos hold cricket sad ,stressed
5.51E+17,kid adult gun violence prevention work may look often time ok none us us wor ,stressed
5.51E+17,damn valentines day sunday amp know work im fuck sad fuck wont b man ,stressed
5.51E+17,remain completely irrelevant sad joke matter two party duopoly ,stressed
5.51E+17,feel like im start scratch every aspect life kinda sad kinda powerful kinda necessary ,stressed
5.51E+17,like situation op expect happen irl think child expose stuff real life online right want burden trauma come adults whine never help ,stressed
5.51E+17,jeremy corbyn wear cardigan uk press man monster boris johnson kill 100162 people uk press aww ,stressed
5.51E+17,feel like im start scratch every aspect life kinda sad kinda powerful kinda necessary ,stressed
5.51E+17,feel like im start scratch every aspect life kinda sad kinda powerful kinda necessary ,stressed
5.51E+17,rn ohio sad story ive cry way many time way home didnt h ,stressed
5.51E+17,im tire mood swing stg ,stressed
5.51E+17,feel like burden sleep hopefully wake hotter unable remember make sad ,stressed
5.51E+17,u make laugh im sad ily ,stressed
5.51E+17,imagine sad make literal shit army twt aint ever gonna survive ,stressed
5.51E+17,cant even wipe stove without lose letter front right eye lose mind matter set stay high stove 4 year old sad ,stressed
5.51E+17,men illogical men great logical express feeling much theres bunch try hard ignore feeling often possible ,stressed
5.51E+17,feel like im start scratch every aspect life kinda sad kinda powerful kinda necessary ,stressed
5.51E+17,thank u wewy much ,stressed
5.51E+17,johnson want think 100000 death act god sad inevitability great lie british prime mini ,stressed
5.51E+17,serious tweet son car really tired unfiltered valved mask great one 5 layer n95type disposable filter build ,stressed
5.51E+17,ppl defend ddlg little space keep say coping mechanism trauma go interro ,stressed
5.51E+17,know answer question let manipulation continue institutional investor havent anything decade happen support leveraged incredibly greedy deserve retail trader ,stressed
5.51E+17,youre almost promise know youre tire keep go u little bastard ,stressed
5.51E+17,feel like im start scratch every aspect life kinda sad kinda powerful kinda necessary ,stressed
5.51E+17,yes thats think also come insecure childhood watch get warrant sale electric cut lie awake think enough ok ashley safe secure also past family fighting dead people fuck ,stressed
5.51E+17,yeonjun love slap soobins im tired ,stressed
5.51E+17,sad even satire trump supporter cuz theyre stupid ,stressed
5.51E+17,noooo whyyyy soo sad ,stressed
5.51E+17,chasing mood around pnw taken xt4 new incredibly capable xf70300 ,stressed
5.51E+17,like sad pls dont wanna see homegirl sad anymore teaser ep 14 chaos ,stressed
5.51E+17,journey normal sleepawake schedule long one lmao ,stressed
5.51E+17,oh god nothing make angry people abuse victim status order justify dumbass fiction doesnt affect reality nonsense fuck romanticize trauma cop mechanism thats fuck unhealthy ,stressed
5.51E+17,sad early morning realize one ask best man suck relationship even friendship ,stressed
5.51E+17,anyone notice hear day im victim im treat fairly biased medium nasty trudea ,stressed
5.51E+17,hm incredibly flattering exacerbating say big brain problem ,stressed
5.51E+17,feel like reason sleep sometimes give eye rest bc feel tired sleepy ,stressed
5.51E+17,thats great im stilll sad tho lose cool peep cuz im sad idiot ,stressed
5.51E+17,feel like im start scratch every aspect life kinda sad kinda powerful kinda necessary ,stressed
5.51E+17,sorry hear suppose depend youd ok driving funerals emotionally exhaust id hate think youre drive youre upset tire x ,stressed
5.51E+17,wont publicize system work sad people power could care less ,stressed
5.51E+17,youre obviously sad michael realizes doesnt wanna make cry ask cuddle two fall asleep ,stressed
5.51E+17,ive text conversation past hour people tell story encounter cloris l ,stressed
5.51E+17,feel like im start scratch every aspect life kinda sad kinda powerful kinda necessary ,stressed
5.51E+17,go sad mf dont get nomo ,stressed
5.51E+17,u make laugh im sad ily ,stressed
5.51E+17,sad newscloris insanely talented could make laugh cry drop hat always pleasure ,stressed
5.51E+17,sad newscloris insanely talented could make laugh cry drop hat always pleasure ,stressed
5.51E+17,sad need play next propaganda conference mean press conference ,stressed
5.51E+17,sad newscloris insanely talented could make laugh cry drop hat always pleasure ,stressed
5.51E+17,sad newscloris insanely talented could make laugh cry drop hat always pleasure ,stressed
5.51E+17,pm bit sad pm deeply sorry scream sycophantic right wing press boris johnson preside 100000 covid dea ,stressed
5.51E+17,sad hear clorisleachman hysterical crush last picture show tell 1990 love fan whinny heres excerpt interview ripclorisleachman fraublucher youngfrankenstein ,stressed
5.51E+17,quick someone write one shot harry louis go bed harry cant fall asleep louis tire wont talk harry start hum tune control louis get annoy take pillow throw shut ,stressed
5.51E+17,weve variety today range canes insomnia cooky adriaticos im still hungry ,stressed
5.50E+17,absolutely hate idea well someone else bad like ur pain trauma completely valid despite ,stressed
5.50E+17,need massage bad back crack im soo mf tire every way possible ,stressed
5.50E+17,youre almost promise know youre tire keep go u little bastard ,stressed
5.50E+17,im already sad 3 minute cba ,stressed
5.50E+17,im say im tire im say think cant say directly cant stop overthink knowgt ,stressed
5.50E+17,offence z love bruin speed think issue hard sit captain need ,stressed
5.50E+17,im literally tired life know live life full shit dont wanna live ,stressed
5.50E+17,get tire learn rest quit ,stressed
5.50E+17,sad true ,stressed
5.50E+17,sad newscloris insanely talented could make laugh cry drop hat always pleasure ,stressed
5.50E+17,sad u great make ,stressed
5.50E+17,get shocked appalled makes bit sad though mean havent meet sort ,stressed
5.50E+17,sad newscloris insanely talented could make laugh cry drop hat always pleasure ,stressed
5.50E+17,feel like im start scratch every aspect life kinda sad kinda powerful kinda necessary ,stressed
5.50E+17,sad wall street screw regular people happen big deal ,stressed
5.50E+17,feel like im start scratch every aspect life kinda sad kinda powerful kinda necessary ,stressed
5.50E+17,sad newscloris insanely talented could make laugh cry drop hat always pleasure ,stressed
5.50E+17,actually get tire work today ,stressed
5.50E+17,im tire politician come bullshit narrative fix racial inequality racism racial inequality change make due law real effect cant stop racism shit dead deceased carcass ,stressed
5.50E+17,kojo go sad feel like go midlife crisis room start ,stressed
5.50E+17,completely sad ill never understand black brown person offend people like ,stressed
5.50E+17,trump make republican party look incredibly weak best thing republicans right end loyalty trump hope one accord ,stressed
5.50E+17,im sad hear cloris leachman pass away age 94 legendary actress win oscar fo ,stressed
5.50E+17,sad newscloris insanely talented could make laugh cry drop hat always pleasure ,stressed
5.50E+17,im tire fat ,stressed
5.50E+17,trans hard cis people never understand feel unbelievably happy trans people get whenever get call pronoun people love ,stressed
5.50E+17,open spotify clear intention stay sad ,stressed
5.50E+17,u sad ,stressed
5.50E+17,im still try get robinhood app work already account app junk right im sad hahaha ,stressed
5.50E+17,youre lucky find person never get tired mood swing ,stressed
5.50E+17,call ugly argument know win cus stress lie ,stressed
5.50E+17,sad many people think normal acceptable behavior doom really wha ,stressed
5.50E+17,feel like im start scratch every aspect life kinda sad kinda powerful kinda necessary ,stressed
5.50E+17,jeremy corbyn wear cardigan uk press man monster boris johnson kill 100162 people uk press aww ,stressed
5.50E+17,girl bachelor act like bad thing escort show continue disrupt feminism movement im sad see still air ,stressed
5.50E+17,seek freedom happiness awake reflect watch work care attention live way light ,stressed
5.50E+17,feel like im start scratch every aspect life kinda sad kinda powerful kinda necessary ,stressed
5.50E+17,realise power establishment destroy socialist party within decade sad tragic ,stressed
5.50E+17,bunch randos get tire big ol asshole use buying power leverage bigg ,stressed
5.50E+17,okay remind somehow get tire life duty ,stressed
5.50E+17,im sad hear cloris leachman pass away age 94 legendary actress win oscar fo ,stressed
5.50E+17,gay black trader tired hear crusty white men ,stressed
5.50E+17,thing go dogooders sad ,stressed
5.50E+17,man game roster sound wild kinda wanna check point im sad timeline probably doesnt work playable ka man want playable ka ,stressed
5.50E+17,im tired ,stressed
5.50E+17,clorisleachman 19262021 valerieharper 19392019 marytylermoore 19362017 sad theyre go great ,stressed
5.50E+17,sad im diana freakin spencer show etc netflix push doc lot use trick amp plaintiff 3 people marriage etc amp think goddamit woman brain spine ,stressed
5.50E+17,rich people sad fuck lmao ,stressed
5.50E+17,someone recreate story sad tokyo ghoul intro vid type beat ,stressed
5.50E+17,love much im sad ,stressed
5.50E+17,im get tire listen republicans whine cry maybe theyd put people millionaire billionaire biden wouldnt sign eos ,stressed
5.50E+17,topic change sad day husky energy staff calgary field ,stressed
5.50E+17,sad hear cloria leachman pass away age 94 loved mel brooks movie ,stressed
5.50E+17,morning 1000s nyc 8th grader school building 1st time 10 month take shsat kid w ,stressed
5.50E+17,una still dey awake ,stressed
5.50E+17,sad newscloris insanely talented could make laugh cry drop hat always pleasure ,stressed
5.50E+17,1988 parent gift two share apple stock guess nows time finally dump sad really ,stressed
5.50E+17,nah im tire ,stressed
5.50E+17,im start believe overexplaining trauma response feel misunderstood andor experience emotional neglect ,stressed
5.50E+17,sad newscloris insanely talented could make laugh cry drop hat always pleasure ,stressed
5.50E+17,im sad ,stressed
5.50E+17,make sad chriss recent post lose someone ,stressed
5.50E+17,tl kinda sad today pick need hear ily lt3 ,stressed
5.50E+17,sad newscloris insanely talented could make laugh cry drop hat always pleasure ,stressed
5.50E+17,sad hear brilliant cloris leachman pass longtime supporter lgbtq equality acceptance ,stressed
5.50E+17,im clean gun dads clean kit find house hit hard emotionally today ,stressed
5.50E+17,im sad send nude ,stressed
5.50E+17,youre lucky find person never get tired mood swing ,stressed
5.50E+17,sad newscloris insanely talented could make laugh cry drop hat always pleasure ,stressed
5.50E+17,hope double chocolate ice coffee extra shot espresso keep awake throughout day sksksksksks ,stressed
5.50E+17,sad newscloris insanely talented could make laugh cry drop hat always pleasure ,stressed
5.50E+17,sad day homeowner california atmosphericriver ,stressed
5.50E+17,probably get tire delete comment really easy make post racist asshole lol ,stressed
5.50E+17,tire work im okay crazy ,stressed
5.50E+17,people break losing losing people one trauma another another break pause time ,stressed
5.50E+17,im sad cant cousin shes give birth first baby covid suck dick ,stressed
5.50E+17,tharnicaa kopika awake weve detain australian government 1059 day chi ,stressed
5.50E+17,feel like im start scratch every aspect life kinda sad kinda powerful kinda necessary ,stressed
5.50E+17,get tire learn rest quit ,stressed
5.50E+17,ian gettin tire way livin god ,stressed
5.50E+17,feel like im start scratch every aspect life kinda sad kinda powerful kinda necessary ,stressed
5.50E+17,wish influence job didnt point weve incredibly bad year across board would like see longshoreman get gig back guy blood sweat tear steam ,stressed
5.50E+17,ill stay awake know ,stressed
5.50E+17,rm weverse 0127 army rm hyung cant make dts rap line rm oh sad rm nice try tho ,stressed
5.50E+17,amt money would pay tencent pull yuri ice wangxian donghua kiss even tho ik thats incredibly unlikely moment choose become optimist ,stressed
5.50E+17,happy birthday balqissss babyboooooo sweet 18 babeeeeeeee wish nice day dont sad ,stressed
5.50E+17,remember jewish people require educate struggle may willing open talk abo ,stressed
5.50E+17,dont know ill ever get tire readinghearing word president biden ,stressed
5.50E+17,aint hard watch hedge fund short 40 share exist people expose crooked system buy share price exceed short hedge fund freak fuck fuck hedge fund end ,stressed
5.50E+17,us 3 solo q get fill feature theyve talk would huge solo q 3 stack preds hold dick sad ,stressed
5.50E+17,sad newscloris insanely talented could make laugh cry drop hat always pleasure ,stressed
5.50E+17,sad sad ,stressed
5.50E+17,sad thing news story get buzz fade away couple day piece shit chad wheeler hell prolly get slap wrist meanwhile kaepernick take knee important issue nfl make life living hell year ,stressed
5.50E+17,sad newscloris insanely talented could make laugh cry drop hat always pleasure ,stressed
5.50E+17,sad newscloris insanely talented could make laugh cry drop hat always pleasure ,stressed
5.50E+17,agree completely also worry lot general political stability urban polity incredibly spike murder rate ,stressed
5.50E+17,sad truthful question wont even open reply retweet shame ,stressed
5.50E+17,sad cowboy emilia colored pencil last year notebook art artist dicksonjanda paint panel oilpaint csulb csulbart charcoal draw lifedrawing prismacolor coloredpencil ,stressed
5.50E+17,sad newscloris insanely talented could make laugh cry drop hat always pleasure ,stressed
5.50E+17,sad newscloris insanely talented could make laugh cry drop hat always pleasure ,stressed
5.50E+17,listengulf instruct draw anything want long choose draw sunflower ,stressed
5.50E+17,tire intend repeat mistake club management must correct situation withdraw f ,stressed
5.50E+17,u make laugh im sad ily ,stressed
5.50E+17,sad newscloris insanely talented could make laugh cry drop hat always pleasure ,stressed
5.50E+17,much wide awake ,stressed
5.50E+17,sad hear clorisleachman hysterical crush last picture show tell 1990 love fan whinny heres excerpt interview ripclorisleachman fraublucher youngfrankenstein ,stressed
5.50E+17,one im sad dont friends one like bye adios au revoir ,stressed
5.50E+17,sad news unexpected new study appear nature since 1970 global shark ray specie decline abut 71 close extinction result overfishing urgent action need halt ,stressed
5.50E+17,feel like im start scratch every aspect life kinda sad kinda powerful kinda necessary ,stressed
5.50E+17,might move server discord sad ,stressed
5.50E+17,sad newscloris insanely talented could make laugh cry drop hat always pleasure ,stressed
5.50E+17,sad part greenwood rashford always get shift different position accommodate martial ,stressed
5.50E+17,sad stuff ,stressed
5.50E+17,thinking time stay home school cause feel depressed friend call ask im tell im cooking bacon cause im feeling sad hear laughter back bitch speaker infront class ,stressed
5.50E+17,sad ,stressed
5.50E+17,yes ikr theyre become disney kpop sad mean already know theyre someone ewording ,stressed
5.50E+17,need guy back never sad ,stressed
5.50E+17,wow wow somone like mg get elect guy trust life answer make go along tell maga base real amp dream come true sad ,stressed
5.50E+17,feel like im start scratch every aspect life kinda sad kinda powerful kinda necessary ,stressed
5.50E+17,many people fail realize gamestop phenomenon incredibly stupid deeply worry funny ,stressed
5.50E+17,summer wasnt angry wasnt tired wasnt scared star nothing star nothing wasnt worried wasnt tired wasnt angry afraid pace throughout day ,stressed
5.50E+17,kid adult gun violence prevention work may look often time ok none us us wor ,stressed
5.50E+17,feel like im start scratch every aspect life kinda sad kinda powerful kinda necessary ,stressed
5.50E+17,tire miss sam default setting ,stressed
5.50E+17,feel like im start scratch every aspect life kinda sad kinda powerful kinda necessary ,stressed
5.50E+17,im sad miss eat rich ,stressed
5.50E+17,god really dont get sad ,stressed
5.50E+17,bro could give shit believe doesnt change still get dont youre lonley sad sack zero good political opinion mental capacity toddler get twitter jerk ,stressed
5.50E+17,razorback fans team thankful effort everyone campus make happen fan ha ,stressed
5.50E+17,feel like im start scratch every aspect life kinda sad kinda powerful kinda necessary ,stressed
5.50E+17,1 want ken open vocal tract sing nawala usually sing neutral vowel uh ,stressed
5.50E+17,trauma ,stressed
5.50E+17,made guy something ,stressed
5.50E+17,tired aint even word ,stressed
5.50E+17,tired take technology push boundary music make accessible people dont need million dollar studio make hit record anymore think rock music die 80s90s youre look hard enough ,stressed
5.50E+17,210127 rm hyung try cant make dts butthis rap line oh sad nice try tho ,stressed
5.50E+17,seeing carnage past president overwhelming sort relive trauma ,stressed
5.50E+17,feel like im start scratch every aspect life kinda sad kinda powerful kinda necessary ,stressed
5.50E+17,sad newscloris insanely talented could make laugh cry drop hat always pleasure ,stressed
5.50E+17,genuinely think jeremy corbyn preside one bad death toll earth nearly bad death rate ,stressed
5.50E+17,count provide explicit notice chargers challengers sell la drivers street fill max cap im tire look bud light car dont make rule ,stressed
5.50E+17,absolutely hate idea well someone else bad like ur pain trauma completely valid despite ,stressed
5.50E+17,tired fake conversation girl literally 2 fuck ,stressed
5.50E+17,work lot part jpe life poor sad always teach look beauty look beauty face got7 grateful bring aspect ahgase see situation ,stressed
5.50E+17,youre almost promise know youre tire keep go u little bastard ,stressed
5.50E+17,dont cover bag eye makeup anymore want people know tired go every ,stressed
5.50E+17,guys making sad ,stressed
5.50E+17,feel like im start scratch every aspect life kinda sad kinda powerful kinda necessary ,stressed
5.50E+17,isnt romantic tension la signora tsarita finally get snezhaya point ,stressed
5.50E+17,house minority leader kevin mccarthy claim americans responsible violent attack capito ,stressed
5.50E+17,feel like im start scratch every aspect life kinda sad kinda powerful kinda necessary ,stressed
5.50E+17,feel like im start scratch every aspect life kinda sad kinda powerful kinda necessary ,stressed
5.50E+17,listen sad music im already sad make even sad ,stressed
5.50E+17,get sad wanna smoke ,stressed
5.50E+17,jo martin doctor 14 shall put indeed thanks thread erika joy spot whats maddening new mistake ageold one seem never get tired make ,stressed
5.50E+17,dont suicide tho would sad lose friend ,stressed
5.50E+17,tolerate lot im tire im tire ,stressed
5.49E+17,solskjaer big inquest weve see many result season character surprised course ,stressed
5.49E+17,sexual tension thought living forest mt makiling disappear 3 year n ,stressed
5.49E+17,omg 20 sad moa ,stressed
5.49E+17,oh sad ,stressed
5.49E+17,theyd good buckle next song start id hate see undergroundyou tell story like lonely people doyou say youre crazyyoure old queeryoure sad lonelyyoure surprised youre still ,stressed
5.49E+17,feel like im start scratch every aspect life kinda sad kinda powerful kinda necessary ,stressed
5.49E+17,feel like im start scratch every aspect life kinda sad kinda powerful kinda necessary ,stressed
5.49E+17,weird dig comment year ago quickly hard forget ,stressed
5.49E+17,whats sad much isaymas write relay reader able read line aot fan ,stressed
5.49E+17,many year politicians lying people amp america fall awake ,stressed
5.49E+17,ok im still awake say need scene piper mclean supermassive black hole ,stressed
5.49E+17,proud jaehyuns perseverance dedication smile never complains abt tire hun ,stressed
5.49E+17,deeply sadden say uniondale ny lose great great kid rip jojo wright absolutely sad wi ,stressed
5.49E+17,feel like im start scratch every aspect life kinda sad kinda powerful kinda necessary ,stressed
5.49E+17,doesnt matter renewal huge ban pp10014 lot family hd suffer dv2020 visa holder also cant enter us ban visa expire soon kindly check sad story ,stressed
5.49E+17,youre almost promise know youre tire keep go u little bastard ,stressed
5.49E+17,many people fail realize gamestop phenomenon incredibly stupid deeply worry funny ,stressed
5.49E+17,sad newscloris insanely talented could make laugh cry drop hat always pleasure ,stressed
5.49E+17,im tire today n get anything doneee oi ,stressed
5.49E+17,u make laugh im sad ily ,stressed
5.49E+17,wake still tire ,stressed
5.49E+17,get man give reassure hug youre give piggy back walk cuz youre tire ,stressed
5.49E+17,people break losing losing people one trauma another another break pause time ,stressed
5.49E+17,lrt check reply qrts im convince many people dont actually know cultural appropriation im really fuck tire say 2 word ,stressed
5.49E+17,sebastian long since awake choose keep eye shut head throb body ached long proper rest even saw belle share bed stir try move open one eye glance directly ,stressed
5.49E+17,sad newscloris insanely talented could make laugh cry drop hat always pleasure ,stressed
5.49E+17,tire feel ugly insecure ,stressed
5.49E+17,sad hear clorisleachman hysterical crush last picture show tell 1990 love fan whinny heres excerpt interview ripclorisleachman fraublucher youngfrankenstein ,stressed
5.49E+17,sad newscloris insanely talented could make laugh cry drop hat always pleasure ,stressed
5.49E+17,maddening sad kid ,stressed
5.49E+17,get fucking fortnite skin end era im tire ,stressed
