post_id,tweet_text,status
4.26E+17,gesture vaguely server constant violence chaos come stuff like war explosion dunno giant mind control demon egg really doesnt give conducive environment deal say trauma ,stressed
4.25E+17,tire ,stressed
4.25E+17,feel like im start scratch every aspect life kinda sad kinda powerful kinda necessary ,stressed
4.25E+17,rough sketch seeing bennett cry make sad bennett razor genshinimpact ,stressed
4.25E+17,idk know man im sad cant find anything make happy ,stressed
4.25E+17,one sad song like exo whole universe album masterpiece cry ,stressed
4.25E+17,get tired hurt swear im good person bro ion deserve shit ,stressed
4.25E+17,truly original large life every unique performance incredibly talented actress deeply missed ,stressed
4.25E+17,make usa fascist dictatorship already dumb politics worry plus get cool banner street ever get tire enlist army set conquer sixteen country step landmine something ,stressed
4.25E+17,im sad hear cloris leachman pass away age 94 legendary actress win oscar fo ,stressed
4.25E+17,take long im stress ,stressed
4.25E+17,im good tired ,stressed
4.25E+17,genuinely think jeremy corbyn preside one bad death toll earth nearly bad death rate ,stressed
4.25E+17,ive tired lately anyone else ,stressed
4.25E+17,nephew eye red cry sad ,stressed
4.25E+17,depression look different everyone everyone depressed cry look sad time people expr ,stressed
4.25E+17,sad read cloris leachman pass loved portrayal phyllis lindstrom mary tyler moore show ,stressed
4.25E+17,gotta figure way keep brain occupied keep awake enough take urge nap 3 hour day end able sleep night im sleepy ,stressed
4.25E+17,feel like im start scratch every aspect life kinda sad kinda powerful kinda necessary ,stressed
4.25E+17,feel like im start scratch every aspect life kinda sad kinda powerful kinda necessary ,stressed
4.25E+17,sad also surprising ,stressed
4.25E+17,im awake ready tackle day got fun collab today excited go today ,stressed
4.25E+17,830 im ready put kid bed much homework today amp get stress need medication ,stressed
4.25E+17,put instagram coz im tire people accuse anyone support farmer take side v ,stressed
4.25E+17,youre almost promise know youre tire keep go u little bastard ,stressed
4.25E+17,sick tire dont wanna mess cause life go ,stressed
4.25E+17,feel like im start scratch every aspect life kinda sad kinda powerful kinda necessary ,stressed
4.25E+17,sad hear god bless soul ,stressed
4.25E+17,world lose rare gem sad multitalented ssr ,stressed
4.25E+17,look soft im sad ,stressed
4.25E+17,sad reality ,stressed
4.24E+17,bae u sad ill make u better u hapy ill make u even happy ,stressed
4.24E+17,sad news even sad anymore thats know ,stressed
4.24E+17,feel like im start scratch every aspect life kinda sad kinda powerful kinda necessary ,stressed
4.23E+17,pm bit sad pm deeply sorry scream sycophantic right wing press boris johnson preside 100000 covid dea ,stressed
4.23E+17,january 6 president trump instigate violent mob storm capitol every member congress tha ,stressed
4.23E+17,im tire argue bitch ,stressed
4.23E+17,team jisung think id never get tired like feel tire ,stressed
4.23E+17,want im tire pass ball ,stressed
4.23E+17,thats sad ,stressed
4.23E+17,wait changkyun said sad doesnt mean sad forever right delusional ,stressed
4.23E+17,sad leave ,stressed
4.23E+17,dont mean johnson tough new variant get behind himvibe fuck right ,stressed
4.23E+17,sad newscloris insanely talented could make laugh cry drop hat always pleasure ,stressed
4.22E+17,sad newscloris insanely talented could make laugh cry drop hat always pleasure ,stressed
4.22E+17,help work write tension bw use race scholarlyacademic interpretation bible race ,stressed
4.22E+17,sad newscloris insanely talented could make laugh cry drop hat always pleasure ,stressed
4.22E+17,sad ,stressed
4.22E+17,kid adult gun violence prevention work may look often time ok none us us wor ,stressed
4.22E+17,hmm whole gamestop thing almost give impression weve construct entire economy around incredib ,stressed
4.22E+17,sad life rotten cling religion like ,stressed
4.21E+17,tire ,stressed
4.21E+17,im tire mf ,stressed
4.21E+17,sad newscloris insanely talented could make laugh cry drop hat always pleasure ,stressed
4.21E+17,stanning lucy wasnt stanning feel like walk house long tired day feel like home walw ,stressed
4.21E+17,ngl c u r come axe get fuck bmg hard lance however nerfs lance nair dipshit move nerfed slight rec good yute could pull sair punishable ,stressed
4.21E+17,sakura talk thing like keep change sannakji malatang clean hard work shes ki ,stressed
4.21E+17,tire yearn girl ,stressed
4.21E+17,imagine tired chloe x halle compare every time go viral like compliment leave ,stressed
4.21E+17,little fanart calm tension last bnha chapter like chapter 298 hehe im worry tamaki ,stressed
4.21E+17,first day week havent walk around exhausted fog say hell damn tired day long ,stressed
4.21E+17,feel like im start scratch every aspect life kinda sad kinda powerful kinda necessary ,stressed
4.21E+17,sad happy ,stressed
4.21E+17,im even sure bruno start arsenal ole say bruno isnt tire sure fuck burn awful ,stressed
4.20E+17,yeah sad honestly ,stressed
4.20E+17,oh sad ,stressed
4.20E+17,christmas ubisoft incredibly nice give bunch code assassins creed valhalla watch dogs legio ,stressed
4.20E+17,know yall tire hear say grateful support us ,stressed
4.20E+17,week shit sleep two hour wake class sleep two wake class fucking tired ,stressed
4.20E+17,sad loss brilliant cloris leachman beyond academy award winner hilarious role young fra ,stressed
4.20E+17,post little stress running around let help reddit ,stressed
4.20E+17,kuns relay cam type video rewatch thousand time never get tire ,stressed
4.20E+17,youre almost promise know youre tire keep go u little bastard ,stressed
4.20E+17,digital painting inspire strange slightly sad feeling get look old photo ,stressed
4.20E+17,im fucking sick michael jordan shit im fuck tire pretend dont give fuck hes garbage play like pussy play shit comp dont give fuck really fuck dont people afraid say shit im ,stressed
4.20E+17,sad much truth ,stressed
4.20E+17,sad newscloris insanely talented could make laugh cry drop hat always pleasure ,stressed
4.20E+17,sad week ,stressed
4.20E+17,im tire disrespect get judge meanwhile ,stressed
4.20E+17,sad life ,stressed
4.19E+17,anyone ever day like physiological need oversharelike dont trauma dump random person 2 second youll literally explode ,stressed
4.19E+17,arent worst swear talk ranboo either im right dont say anything take criticism dont get mad antything get sad tbh idk im gonna high school ehh want ,stressed
4.19E+17,oh im sad literally wait get pay please let us know another ,stressed
4.19E+17,sub sai kum ker rehi hoon tension ki wajah sai okay guy kul baat hoghi study goodnight ,stressed
4.19E+17,blaming astrology im tired instead actually fix sleep schedule ,stressed
4.19E+17,depression look different everyone everyone depressed cry look sad time people expr ,stressed
4.19E+17,miss need selfie im sadhelp girl louis selfie fix everything ,stressed
4.19E+17,im really rampb bul fr get tire listen trap shit allday ,stressed
4.19E+17,feel like im start scratch every aspect life kinda sad kinda powerful kinda necessary ,stressed
4.19E+17,sad look kid wipe lockdown victims politician vaccine industry ,stressed
4.19E+17,feel like im start scratch every aspect life kinda sad kinda powerful kinda necessary ,stressed
4.19E+17,sad newscloris insanely talented could make laugh cry drop hat always pleasure ,stressed
4.19E+17,state emergencytoday sad day herd run remain foodwe need collect 300 ,stressed
4.19E+17,basically fill cto since last week since go leave first child thing go well many thing actually stress anything particularly well cant wait come back soon ,stressed
4.19E+17,ty4 rt openandhonest truestory gay man childhood trauma love crime forgiveness bookboost biography amwriting amreading ptsd csa lgbt comingofage comingout damage ,stressed
4.19E+17,im tire today n get anything doneee oi ,stressed
4.19E+17,feel like im start scratch every aspect life kinda sad kinda powerful kinda necessary ,stressed
4.18E+17,dont forget sleep awake protect land biafra esn pray htt ,stressed
4.18E+17,tw covid ive uterine biopsy fully awake unmedicated still unsettling brief medica ,stressed
4.18E+17,nonathlete citizen concussion serve might get hard get treatment hope seahawks help recover ptsdpost concussion clear dilated eye definitely endure trauma ,stressed
4.18E+17,drive offensive menace possible somebody try effect good traumat ,stressed
4.18E+17,2016 resign work 2017 start business 20182019 business well 2020 financial struggle client com ,stressed
4.18E+17,call sad lonely bitch wholl never find love like one celine jesse ,stressed
4.18E+17,awwww thats great get ghost good friend im good listener come feel sad ,stressed
4.18E+17,im really get tire see bs show netflix amp noelle stevenson yeah abusive relationship especially ,stressed
4.18E+17,awake stream around hour ,stressed
4.18E+17,another note trans ppl call fetichists depict body like draw men like us wit ,stressed
4.18E+17,pretty person next concert sit banner ive sad ever since ,stressed
4.18E+17,nakd radar 08 16 buy today 73 sell loss 65 sad story get nerve steel game ,stressed
4.18E+17,remember shit right wing tabloid go vital everyone buy newspaper could ,stressed
4.17E+17,pronoun sadhorny ,stressed
4.17E+17,gamestop insider sad ,stressed
4.17E+17,sad hear die today nice lady buh bye lunch buddy clorisleachman 44 ,stressed
4.17E+17,artist sad gay people listen thread ,stressed
4.17E+17,monsters rely cooky fake ad chromatica crumb get tired ,stressed
4.17E+17,make cry 8 minute straight watch sad moment futurama guy fun ,stressed
4.17E+17,u make laugh im sad ily ,stressed
4.17E+17,another note trans ppl call fetichists depict body like draw men like us wit ,stressed
4.17E+17,angry tired read news happen every day qamar kill brother leave ,stressed
4.17E+17,feel like im start scratch every aspect life kinda sad kinda powerful kinda necessary ,stressed
4.17E+17,feel like im start scratch every aspect life kinda sad kinda powerful kinda necessary ,stressed
4.17E+17,sad newscloris insanely talented could make laugh cry drop hat always pleasure ,stressed
4.17E+17,thesis drive force 2021 everybody incredibly bore ,stressed
4.17E+17,sad thing republicans lose control party hate knowingly enable al ,stressed
4.17E+17,im tire feel like political pawn ,stressed
4.17E+17,sad hear clorisleachman hysterical crush last picture show tell 1990 love fan whinny heres excerpt interview ripclorisleachman fraublucher youngfrankenstein ,stressed
4.17E+17,wow bar tender toilet scrub day turn robin hood chip shoulder politics bring bad college degree show token position sad ,stressed
4.16E+17,another note trans ppl call fetichists depict body like draw men like us wit ,stressed
4.16E+17,bob big supporter poker community content really sad hear news ,stressed
4.16E+17,lol thats enough today hope get help need sad strange pathetic little man ,stressed
4.16E+17,feel like im start scratch every aspect life kinda sad kinda powerful kinda necessary ,stressed
4.16E+17,sad need remind yall everyday ,stressed
4.16E+17,sad newscloris insanely talented could make laugh cry drop hat always pleasure ,stressed
5.69E+17,top tier could eat daily never get tired lol ,stressed
5.69E+17,free anything im get tire free show inquire sorry sorry ,stressed
5.69E+17,wowww sad ,stressed
5.69E+17,still plan drag event though still doubt people join selfrp see people go interact idk especially im tire often timezone big problem ill draw thing need keep drawing stay sane ,stressed
5.68E+17,wasnt wide awake id block dull could run claim win couple cultist ,stressed
5.68E+17,gifted actress cloris leachman pass away today 94 sad talented funny woman ,stressed
5.68E+17,dr johnson say youre tire london youre tire life visit london best lifelondonislovinit ,stressed
5.68E+17,dey tension people abeg ,stressed
5.68E+17,made guy something ,stressed
5.68E+17,sad newscloris insanely talented could make laugh cry drop hat always pleasure ,stressed
5.68E+17,oh sad ,stressed
5.68E+17,tired write clever tweet come continue play age calamity ,stressed
5.68E+17,tired fucker ,stressed
5.68E+17,feel like im start scratch every aspect life kinda sad kinda powerful kinda necessary ,stressed
5.68E+17,well personally never really like mlp reboot g4 give credit credit due mlp end pretty good note thomas kind sad mattel treat property well ,stressed
5.67E+17,today wear white buttondown im tire want think im finally wear ,stressed
5.67E+17,im sad goodbye ,stressed
5.63E+17,sad day someone dedicate factual reporting leave country protect thug dems ,stressed
5.63E+17,im sorry loss lose love one always incredibly difficult take time grieve ,stressed
5.63E+17,wonder im tire time ,stressed
5.62E+17,absolutely hate idea well someone else bad like ur pain trauma completely valid despite ,stressed
5.62E+17,new documentary womans work examine harassment ogling incredibly low pay nfl cheerleader receive ,stressed
5.61E+17,yeah sad guy chance survive ,stressed
5.61E+17,whats food slander im sad ,stressed
5.61E+17,marked alitas character little sad hugos death main concern whether sequel ,stressed
5.61E+17,sad lol ,stressed
5.61E+17,long sad ,stressed
5.61E+17,feel like im start scratch every aspect life kinda sad kinda powerful kinda necessary ,stressed
5.61E+17,sad newscloris insanely talented could make laugh cry drop hat always pleasure ,stressed
5.61E+17,sad newscloris insanely talented could make laugh cry drop hat always pleasure ,stressed
5.61E+17,sad newscloris insanely talented could make laugh cry drop hat always pleasure ,stressed
5.61E+17,god episode 20 start sad note ,stressed
5.61E+17,jugyeong say tire suho give piggyback ride want lee suho boyfriend truebeauty ,stressed
5.61E+17,valid im sad ,stressed
5.61E+17,yoongi extremely stress run episode 126 ,stressed
5.61E+17,hey anyone believe douglass mackey aka ricky vaughn go keep mouth shut coconspirator sa ,stressed
5.61E+17,come take im tire ,stressed
5.61E+17,oh sad ,stressed
5.60E+17,still awake ,stressed
5.60E+17,finish flower evil like yesterday think forget im sad end literally expect ,stressed
5.60E+17,wake still cry couple hour everyday trauma real ,stressed
5.60E+17,v move yesterday push cart block really tired thank lani aaa ,stressed
5.60E+17,thanks aha however diagnose mental illness experience massive trauma 3yrs present go catholic primary school pray every night come im atheist thank word good intention ,stressed
5.60E+17,sad newscloris insanely talented could make laugh cry drop hat always pleasure ,stressed
5.60E+17,common sense 1precious therapist trait 2very hard teach 3often ruin train program thatemphasize jargon ,stressed
5.60E+17,feel like im start scratch every aspect life kinda sad kinda powerful kinda necessary ,stressed
5.60E+17,sexual tension parish lydia ,stressed
5.60E+17,sad hear cloris leachmans pass little known fact cast original production arthur millers ,stressed
5.60E+17,also youre feeling sad whole situation im tell feeling valid youre selfish fo ,stressed
5.60E+17,ever since debut weve always tomoon concert broadcast look back time seem like ,stressed
5.60E+17,yeah fun story seem overwhelmingly likely sad end ,stressed
5.60E+17,feel like im start scratch every aspect life kinda sad kinda powerful kinda necessary ,stressed
5.59E+17,made guy something ,stressed
5.59E+17,horrifying officer suppose help calm student incredibly dysregulated ,stressed
5.59E+17,plenty exmuslims leave religion due personal trauma dont go become genocidal maniac nothing ever go excuse kind misery want inflict million people ,stressed
5.59E+17,noticing interesting similarity number sport metaphor use church business class yeah definitely religious trauma involve right right ,stressed
5.59E+17,brokenhearted meet week ago kind shes one people whos hold cricket sad ,stressed
5.59E+17,kid adult gun violence prevention work may look often time ok none us us wor ,stressed
5.59E+17,damn valentines day sunday amp know work im fuck sad fuck wont b man ,stressed
4.34E+17,remain completely irrelevant sad joke matter two party duopoly ,stressed
3706233469,feel like im start scratch every aspect life kinda sad kinda powerful kinda necessary ,stressed
3706232116,like situation op expect happen irl think child expose stuff real life online right want burden trauma come adults whine never help ,stressed
3705522971,jeremy corbyn wear cardigan uk press man monster boris johnson kill 100162 people uk press aww ,stressed
3705521704,feel like im start scratch every aspect life kinda sad kinda powerful kinda necessary ,stressed
3705519624,feel like im start scratch every aspect life kinda sad kinda powerful kinda necessary ,stressed
3705518449,rn ohio sad story ive cry way many time way home didnt h ,stressed
3705512118,im tire mood swing stg ,stressed
3704568338,feel like burden sleep hopefully wake hotter unable remember make sad ,stressed
3704566858,u make laugh im sad ily ,stressed
3704010853,imagine sad make literal shit army twt aint ever gonna survive ,stressed
3703640115,cant even wipe stove without lose letter front right eye lose mind matter set stay high stove 4 year old sad ,stressed
3702980519,men illogical men great logical express feeling much theres bunch try hard ignore feeling often possible ,stressed
3702497761,feel like im start scratch every aspect life kinda sad kinda powerful kinda necessary ,stressed
3702495409,thank u wewy much ,stressed
3702494061,johnson want think 100000 death act god sad inevitability great lie british prime mini ,stressed
3702492959,serious tweet son car really tired unfiltered valved mask great one 5 layer n95type disposable filter build ,stressed
3701435317,ppl defend ddlg little space keep say coping mechanism trauma go interro ,stressed
3701434805,know answer question let manipulation continue institutional investor havent anything decade happen support leveraged incredibly greedy deserve retail trader ,stressed
3701434180,youre almost promise know youre tire keep go u little bastard ,stressed
3701433649,feel like im start scratch every aspect life kinda sad kinda powerful kinda necessary ,stressed
3701433037,yes thats think also come insecure childhood watch get warrant sale electric cut lie awake think enough ok ashley safe secure also past family fighting dead people fuck ,stressed
3695019640,yeonjun love slap soobins im tired ,stressed
3695017295,sad even satire trump supporter cuz theyre stupid ,stressed
3694412213,noooo whyyyy soo sad ,stressed
3693780960,chasing mood around pnw taken xt4 new incredibly capable xf70300 ,stressed
3693398679,like sad pls dont wanna see homegirl sad anymore teaser ep 14 chaos ,stressed
3693394321,journey normal sleepawake schedule long one lmao ,stressed
3693369689,oh god nothing make angry people abuse victim status order justify dumbass fiction doesnt affect reality nonsense fuck romanticize trauma cop mechanism thats fuck unhealthy ,stressed
3693366942,sad early morning realize one ask best man suck relationship even friendship ,stressed
3693359830,anyone notice hear day im victim im treat fairly biased medium nasty trudea ,stressed
3692627761,hm incredibly flattering exacerbating say big brain problem ,stressed
3692127984,feel like reason sleep sometimes give eye rest bc feel tired sleepy ,stressed
3692126463,thats great im stilll sad tho lose cool peep cuz im sad idiot ,stressed
3692124595,feel like im start scratch every aspect life kinda sad kinda powerful kinda necessary ,stressed
3691575402,sorry hear suppose depend youd ok driving funerals emotionally exhaust id hate think youre drive youre upset tire x ,stressed
3691024095,wont publicize system work sad people power could care less ,stressed
3690431509,youre obviously sad michael realizes doesnt wanna make cry ask cuddle two fall asleep ,stressed
3690429705,ive text conversation past hour people tell story encounter cloris l ,stressed
3690427890,feel like im start scratch every aspect life kinda sad kinda powerful kinda necessary ,stressed
3690426357,go sad mf dont get nomo ,stressed
3689245624,u make laugh im sad ily ,stressed
3689241514,sad newscloris insanely talented could make laugh cry drop hat always pleasure ,stressed
3689240666,sad newscloris insanely talented could make laugh cry drop hat always pleasure ,stressed
3689239623,sad need play next propaganda conference mean press conference ,stressed
3689238467,sad newscloris insanely talented could make laugh cry drop hat always pleasure ,stressed
3688303374,sad newscloris insanely talented could make laugh cry drop hat always pleasure ,stressed
3688301710,pm bit sad pm deeply sorry scream sycophantic right wing press boris johnson preside 100000 covid dea ,stressed
3688300501,sad hear clorisleachman hysterical crush last picture show tell 1990 love fan whinny heres excerpt interview ripclorisleachman fraublucher youngfrankenstein ,stressed
3688299810,quick someone write one shot harry louis go bed harry cant fall asleep louis tire wont talk harry start hum tune control louis get annoy take pillow throw shut ,stressed
3687642343,weve variety today range canes insomnia cooky adriaticos im still hungry ,stressed
3687026933,absolutely hate idea well someone else bad like ur pain trauma completely valid despite ,stressed
3687026582,need massage bad back crack im soo mf tire every way possible ,stressed
3687026206,youre almost promise know youre tire keep go u little bastard ,stressed
3686585319,im already sad 3 minute cba ,stressed
3686584373,im say im tire im say think cant say directly cant stop overthink knowgt ,stressed
3686580274,offence z love bruin speed think issue hard sit captain need ,stressed
3686579417,im literally tired life know live life full shit dont wanna live ,stressed
3686213024,get tire learn rest quit ,stressed
3686211638,sad true ,stressed
3686210715,sad newscloris insanely talented could make laugh cry drop hat always pleasure ,stressed
3686209896,sad u great make ,stressed
3686209115,get shocked appalled makes bit sad though mean havent meet sort ,stressed
3685803057,sad newscloris insanely talented could make laugh cry drop hat always pleasure ,stressed
3685802777,feel like im start scratch every aspect life kinda sad kinda powerful kinda necessary ,stressed
3685802551,sad wall street screw regular people happen big deal ,stressed
3685802338,feel like im start scratch every aspect life kinda sad kinda powerful kinda necessary ,stressed
3685324796,sad newscloris insanely talented could make laugh cry drop hat always pleasure ,stressed
3685035469,actually get tire work today ,stressed
3685034760,im tire politician come bullshit narrative fix racial inequality racism racial inequality change make due law real effect cant stop racism shit dead deceased carcass ,stressed
3684750614,kojo go sad feel like go midlife crisis room start ,stressed
3684749764,completely sad ill never understand black brown person offend people like ,stressed
3684748253,trump make republican party look incredibly weak best thing republicans right end loyalty trump hope one accord ,stressed
3684552335,im sad hear cloris leachman pass away age 94 legendary actress win oscar fo ,stressed
3684551275,sad newscloris insanely talented could make laugh cry drop hat always pleasure ,stressed
3683945824,im tire fat ,stressed
3683944758,trans hard cis people never understand feel unbelievably happy trans people get whenever get call pronoun people love ,stressed
3683944417,open spotify clear intention stay sad ,stressed
3683931471,u sad ,stressed
3683930626,im still try get robinhood app work already account app junk right im sad hahaha ,stressed
3683279233,youre lucky find person never get tired mood swing ,stressed
3683277483,call ugly argument know win cus stress lie ,stressed
3683276715,sad many people think normal acceptable behavior doom really wha ,stressed
3682645163,feel like im start scratch every aspect life kinda sad kinda powerful kinda necessary ,stressed
3682644057,jeremy corbyn wear cardigan uk press man monster boris johnson kill 100162 people uk press aww ,stressed
3682643560,girl bachelor act like bad thing escort show continue disrupt feminism movement im sad see still air ,stressed
3682642585,seek freedom happiness awake reflect watch work care attention live way light ,stressed
3682007099,feel like im start scratch every aspect life kinda sad kinda powerful kinda necessary ,stressed
3682005921,realise power establishment destroy socialist party within decade sad tragic ,stressed
3681157847,bunch randos get tire big ol asshole use buying power leverage bigg ,stressed
3681156433,okay remind somehow get tire life duty ,stressed
3681155314,im sad hear cloris leachman pass away age 94 legendary actress win oscar fo ,stressed
3681154564,gay black trader tired hear crusty white men ,stressed
3681153727,thing go dogooders sad ,stressed
3680369687,man game roster sound wild kinda wanna check point im sad timeline probably doesnt work playable ka man want playable ka ,stressed
3680367999,im tired ,stressed
3680366003,clorisleachman 19262021 valerieharper 19392019 marytylermoore 19362017 sad theyre go great ,stressed
3679404885,sad im diana freakin spencer show etc netflix push doc lot use trick amp plaintiff 3 people marriage etc amp think goddamit woman brain spine ,stressed
3679402529,rich people sad fuck lmao ,stressed
3679399784,someone recreate story sad tokyo ghoul intro vid type beat ,stressed
3679398328,love much im sad ,stressed
